{
  "schema_version": "1.0",
  "document_id": "gold_late",
  "document_type": "judgment",
  "source_text": "\u2026",
  "facts": [
    {
      "id": "f1",
      "entity": "effective date of termination",
      "role": "END",
      "value": "2025-07-12",
      "raw_text": "2025-07-12",
      "timex_type": "DATE",
      "sentence": "The claimant was dismissed with effect from 12 July 2025.",
      "confidence": 1.0,
      "signal_verb": null,
      "signal_prep": null,
      "temporal_content": true,
      "start_char": 0,
      "end_char": 0,
      "date_parsed": "2025-07-12"
    },
    {
      "id": "f2",
      "entity": "claim presented to the tribunal",
      "role": "START",
      "value": "2025-10-20",
      "raw_text": "2025-10-10",
      "timex_type": "DATE",
      "sentence": "The claim was presented to the tribunal on 20 October 2025.",
      "confidence": 1.0,
      "signal_verb": null,
      "signal_prep": null,
      "temporal_content": true,
      "start_char": 0,
      "end_char": 0,
      "date_parsed": "2025-10-20"
    },
    {
      "id": "f3",
      "entity": "preliminary hearing",
      "role": "START",
      "value": "2025-11-05",
      "raw_text": "2025-11-05",
      "timex_type": "DATE",
      "sentence": "A preliminary hearing took place on 5 November 2025.",
      "confidence": 1.0,
      "signal_verb": null,
      "signal_prep": null,
      "temporal_content": true,
      "start_char": 0,
      "end_char": 0,
      "date_parsed": "2025-11-05"
    }
  ],
  "dependencies": [],
  "edit_scenarios": []
}